{
  "version": "relay.t5-resolution-corpus.v0.1",
  "status": "PROPOSED_SYNTHETIC_ONLY",
  "baseline": {
    "local": {
      "namespaceRef": "fictional:personal",
      "accountRef": "fictional:account-a",
      "authorizerRef": "fictional:authorizer-a",
      "targetId": "22222222222222222222222222222222",
      "profileId": "33333333333333333333333333333333",
      "brokerStartGeneration": "55555555555555555555555555555555",
      "policyRef": "fictional:policy-a",
      "policyDigest": "aaaaaaaaaaaaaaaaaaaaaaaaaaaaaaaaaaaaaaaaaaaaaaaaaaaaaaaaaaaaaaaa",
      "nowTick": 100
    },
    "pending": {
      "request": {
        "version": "relay.native-request.v0.1",
        "requestId": "11111111111111111111111111111111",
        "operation": "windows.runtime_inventory.v0_1",
        "brokerKeyId": "698bea63dc44a344663ff1429aea10842df27b6b991ef25866b2c6c02cdcc5be",
        "targetId": "22222222222222222222222222222222",
        "profileId": "33333333333333333333333333333333",
        "enrollmentGeneration": "44444444444444444444444444444444",
        "brokerStartGeneration": "55555555555555555555555555555555",
        "nonce": "6666666666666666666666666666666666666666666666666666666666666666",
        "fields": [
          "windows",
          "powershell7",
          "node"
        ],
        "ttlMs": 60000
      },
      "requestDigest": "caf7c7db28ad6e51d6d332073e2e68fc32489a8848d50005a0d1a9f0bdfc71b1"
    },
    "snapshot": {
      "storeState": "available",
      "epochBefore": "77777777777777777777777777777777",
      "epochSnapshot": "77777777777777777777777777777777",
      "epochAfter": "77777777777777777777777777777777",
      "policy": {
        "policyRef": "fictional:policy-a",
        "policyDigest": "aaaaaaaaaaaaaaaaaaaaaaaaaaaaaaaaaaaaaaaaaaaaaaaaaaaaaaaaaaaaaaaa",
        "validFromTick": 90,
        "validUntilTick": 110
      },
      "records": [
        {
          "namespaceRef": "fictional:personal",
          "accountRef": "fictional:account-a",
          "authorizerRef": "fictional:authorizer-a",
          "targetId": "22222222222222222222222222222222",
          "profileId": "33333333333333333333333333333333",
          "enrollmentGeneration": "44444444444444444444444444444444",
          "brokerKeyId": "698bea63dc44a344663ff1429aea10842df27b6b991ef25866b2c6c02cdcc5be",
          "brokerSec1Hex": "046b17d1f2e12c4247f8bce6e563a440f277037d812deb33a0f4a13945d898c2964fe342e2fe1a7f9b8ee7eb4a7c0f9e162bce33576b315ececbb6406837bf51f5",
          "approverSec1Hex": "047cf27b188d034f7e8a52380304b51ac3c08969e277f21b35a60b48fc4766997807775510db8ed040293d9ac69f7430dbba7dade63ce982299e04b79d227873d1",
          "transportSpkiPin": "2b985badf1bac8293f6b92e8c0acc1139bc5a5ecbbf97a6271dcf0d4f6c68af6",
          "policyRef": "fictional:policy-a",
          "lifecycle": "active"
        }
      ]
    },
    "presented": {
      "request": {
        "version": "relay.native-request.v0.1",
        "requestId": "11111111111111111111111111111111",
        "operation": "windows.runtime_inventory.v0_1",
        "brokerKeyId": "698bea63dc44a344663ff1429aea10842df27b6b991ef25866b2c6c02cdcc5be",
        "targetId": "22222222222222222222222222222222",
        "profileId": "33333333333333333333333333333333",
        "enrollmentGeneration": "44444444444444444444444444444444",
        "brokerStartGeneration": "55555555555555555555555555555555",
        "nonce": "6666666666666666666666666666666666666666666666666666666666666666",
        "fields": [
          "windows",
          "powershell7",
          "node"
        ],
        "ttlMs": 60000
      },
      "brokerSec1Hex": "046b17d1f2e12c4247f8bce6e563a440f277037d812deb33a0f4a13945d898c2964fe342e2fe1a7f9b8ee7eb4a7c0f9e162bce33576b315ececbb6406837bf51f5",
      "approverSec1Hex": "047cf27b188d034f7e8a52380304b51ac3c08969e277f21b35a60b48fc4766997807775510db8ed040293d9ac69f7430dbba7dade63ce982299e04b79d227873d1",
      "transportSec1Hex": "045ecbe4d1a6330a44c8f7ef951d4bf165e6c6b721efada985fb41661bc6e7fd6c8734640c4998ff7e374b06ce1a64a2ecd82ab036384fb83d9a79b127a27d5032"
    }
  },
  "cases": [
    {"id":"baseline","expected":{"status":"candidate-consistent","code":null,"operationalAuthority":"absent"}},
    {"id":"company-control","expected":{"status":"candidate-consistent","code":null,"operationalAuthority":"absent"}},
    {"id":"store-missing","expected":{"status":"denied","code":"StoreUnavailable","operationalAuthority":"absent"}},
    {"id":"store-inaccessible","expected":{"status":"denied","code":"StoreUnavailable","operationalAuthority":"absent"}},
    {"id":"store-corrupt","expected":{"status":"denied","code":"StoreUnavailable","operationalAuthority":"absent"}},
    {"id":"null-epochbefore","expected":{"status":"denied","code":"StoreUnavailable","operationalAuthority":"absent"}},
    {"id":"null-epochsnapshot","expected":{"status":"denied","code":"StoreUnavailable","operationalAuthority":"absent"}},
    {"id":"null-epochafter","expected":{"status":"denied","code":"StoreUnavailable","operationalAuthority":"absent"}},
    {"id":"epoch-snapshot-changed","expected":{"status":"denied","code":"StoreChanged","operationalAuthority":"absent"}},
    {"id":"epoch-after-changed","expected":{"status":"denied","code":"StoreChanged","operationalAuthority":"absent"}},
    {"id":"epoch-after-old","expected":{"status":"denied","code":"StoreChanged","operationalAuthority":"absent"}},
    {"id":"policy-null","expected":{"status":"denied","code":"PolicyUnavailable","operationalAuthority":"absent"}},
    {"id":"policy-empty","expected":{"status":"denied","code":"PolicyUnavailable","operationalAuthority":"absent"}},
    {"id":"policy-reversed","expected":{"status":"denied","code":"PolicyUnavailable","operationalAuthority":"absent"}},
    {"id":"policy-before-start","expected":{"status":"denied","code":"PolicyUnavailable","operationalAuthority":"absent"}},
    {"id":"policy-exact-start","expected":{"status":"candidate-consistent","code":null,"operationalAuthority":"absent"}},
    {"id":"policy-before-expiry","expected":{"status":"candidate-consistent","code":null,"operationalAuthority":"absent"}},
    {"id":"policy-exact-expiry","expected":{"status":"denied","code":"PolicyUnavailable","operationalAuthority":"absent"}},
    {"id":"policy-after-expiry","expected":{"status":"denied","code":"PolicyUnavailable","operationalAuthority":"absent"}},
    {"id":"policy-ref","expected":{"status":"denied","code":"PolicyMismatch","operationalAuthority":"absent"}},
    {"id":"policy-digest","expected":{"status":"denied","code":"PolicyMismatch","operationalAuthority":"absent"}},
    {"id":"no-records","expected":{"status":"denied","code":"NoRecord","operationalAuthority":"absent"}},
    {"id":"duplicate-record","expected":{"status":"denied","code":"AmbiguousRecord","operationalAuthority":"absent"}},
    {"id":"record-selection-namespaceref","expected":{"status":"denied","code":"NoRecord","operationalAuthority":"absent"}},
    {"id":"local-selection-namespaceref","expected":{"status":"denied","code":"NoRecord","operationalAuthority":"absent"}},
    {"id":"record-selection-accountref","expected":{"status":"denied","code":"NoRecord","operationalAuthority":"absent"}},
    {"id":"local-selection-accountref","expected":{"status":"denied","code":"NoRecord","operationalAuthority":"absent"}},
    {"id":"record-selection-targetid","expected":{"status":"denied","code":"NoRecord","operationalAuthority":"absent"}},
    {"id":"local-selection-targetid","expected":{"status":"denied","code":"NoRecord","operationalAuthority":"absent"}},
    {"id":"presented-cannot-repair-targetid","expected":{"status":"denied","code":"NoRecord","operationalAuthority":"absent"}},
    {"id":"record-selection-profileid","expected":{"status":"denied","code":"NoRecord","operationalAuthority":"absent"}},
    {"id":"local-selection-profileid","expected":{"status":"denied","code":"NoRecord","operationalAuthority":"absent"}},
    {"id":"presented-cannot-repair-profileid","expected":{"status":"denied","code":"NoRecord","operationalAuthority":"absent"}},
    {"id":"unrelated-company","expected":{"status":"candidate-consistent","code":null,"operationalAuthority":"absent"}},
    {"id":"company-cannot-grant-personal","expected":{"status":"denied","code":"NoRecord","operationalAuthority":"absent"}},
    {"id":"authorizer-binding","expected":{"status":"denied","code":"BindingMismatch","operationalAuthority":"absent"}},
    {"id":"record-policy","expected":{"status":"denied","code":"PolicyMismatch","operationalAuthority":"absent"}},
    {"id":"revoked","expected":{"status":"denied","code":"Revoked","operationalAuthority":"absent"}},
    {"id":"revoked-after-lookup","expected":{"status":"denied","code":"StoreChanged","operationalAuthority":"absent"}},
    {"id":"pending-binding-targetid","expected":{"status":"denied","code":"BindingMismatch","operationalAuthority":"absent"}},
    {"id":"pending-binding-profileid","expected":{"status":"denied","code":"BindingMismatch","operationalAuthority":"absent"}},
    {"id":"record-generation","expected":{"status":"denied","code":"GenerationMismatch","operationalAuthority":"absent"}},
    {"id":"local-start","expected":{"status":"denied","code":"GenerationMismatch","operationalAuthority":"absent"}},
    {"id":"pending-generation-enrollmentgeneration","expected":{"status":"denied","code":"GenerationMismatch","operationalAuthority":"absent"}},
    {"id":"pending-generation-brokerstartgeneration","expected":{"status":"denied","code":"GenerationMismatch","operationalAuthority":"absent"}},
    {"id":"valid-broker-restart","expected":{"status":"candidate-consistent","code":null,"operationalAuthority":"absent"}},
    {"id":"record-key-id","expected":{"status":"denied","code":"KeyMismatch","operationalAuthority":"absent"}},
    {"id":"pending-key-id","expected":{"status":"denied","code":"KeyMismatch","operationalAuthority":"absent"}},